question,answer,srno
A new autonomous body should not be created without the approval of the,Cabinet,01:
Thus Grants-in-aid including scholarships may be sanctioned by an authority competent to do so under the provisions mentioned there in,Delegation of Financial Powers Rules,02:
Regional Centres/Offices/Sub-Stations of any autonomous body can be created with prior approval of the,Administrative Min/Department,03:
A Corpus Fund out of budgetary allocation for an Autonomous Body may be created only with prior concurrence of,Ministry of Finance,04:
A Corpus Fund out of internal resources for an Autonomous Body may be created with the concurrence of,Administrative Min/Department,05:
User charges/ sources of internal revenue generation of an autonomous body should be review by,Governing Body,06:
User charges/ sources of internal revenue generation of an autonomous body should be review at-least once,a year (preferably before the formulation of Union Annual Budget),07:
Responsible for overall financial management of the autonomous bodies is,Chief Executive Officer,08:
Peer review of autonomous organisations whether external or internal shall be made every,3 or 5 years depending on the size of the autonomous body.,09:
Autonomous organisations are need to enter into a Memorandum of Understanding with the Admin. Min/Department where the budgetary support is,More than ₹ 5 crore,10:
Findings of the peer review should be put up by the concerned programme division of the Department for appropriate decision to,the Secretary,11:
In the cases of the schemes where Grants are given as part of the expenditure on reimbursement basis the same will be treated as,the Central Financial Assistance (CFA),12:
"Before releasing any grant to an autonomous organisation, it should be ensured that Cash balance at a time should preferably not be more than",3 months of requirements,13:
"On finalisation of account of a grantee, all interests or other earnings against Grants in aid or advances other than reimbursement) released should be",Remitted to Consolidated Fund of India,14:
Non-Govt. or Quasi-Govt. Institutions or Organisations cannot dispose of assets acquired wholly or substantially out of Government Grants without the approval of,Grant sanctioning authority,15:
Entities desiring Grants from Govt. shall submit their requirement with supporting details by end of the month of,September in the year preceding the year for which the Grants-in-aid is sough,16:
The Admin. Min/Department should inform the result the requests of entities for grant by,April of the succeeding year,17:
"terms and conditions of service of their employee should be formulated by all Grantee entities, which receive",50% of their recurring expenditure in the form of Grants-in-aid,18:
"Relaxation with regard to formulation of terms and conditions of service of their employee, where required, may be made in consultation with",the Ministry of Finance.,19:
"In all cases of buildings constructed with Grants- in-aid, responsibility of maintenance of such buildings shall rest with",The grantee entities.,20:
Grants-in-aid may be sanctioned to meet the bonafide expenditure incurred not earlier than,2 years prior to the date of issue of the sanction,21:
"As a precondition to the sanction of Grants-in-aid to theagencies it should be ensured that a suitable clause is invariably included in the terms and conditions of grant, to provide for reservation for SC/ST/OBC in posts and services under such organizations or agencies.",,22:
"Terms and conditions of grant, to provide for reservation for SC/ST/OBC in posts and services where the at least 50% of its recurring expenditure of grantees is met from Grants-in-aid from Central Govt. and employs",More than 20 persons on a regular basis and,23:
"Terms and conditions of grant, to provide for reservation for SC/ST/OBC in posts and services where the grantee body is a registered society or a co-operative institution and is in receipt of a general purpose annual Grants-in-aid of",₹ 25 lakh and above,24:
"In respect of a voluntary organisation, the Grants-in-aid should not exceed",25%. of approved administrative expenditure on pay and allowances of the personnel of the voluntary organisation concerned;,25:
"In case a voluntary organisation fails to comply the terms and conditions of Bond executed, the whole or a part amount of the Grant will liable to be refunded along with penal interest at the rate of",0.1,26:
Exempted from execution of bond for grant-in-aid are,"Quasi Govt. institution, Central Autonomous Organisations and Institutions whose budget is approved by the Government",27:
The cost of stamp duty for the Bond executed between the Government and Voluntary organisation will be borne by,The Government,28:
The Centrally Sponsored scheme should be designed in consultation with,States and Union Territories.,29:
The release of funds under Centrally Sponsored scheme to State Governments and monitoring further utilisation should be undertaken through,PFMS,30:
A post-completion review of every Centrally Sponsored Scheme should be undertaken by,State Govt. and UT implementing the scheme,31:
The sanctioning authority shall maintain a Register of Grants in form,GFR-21,32:
"Institutions or Organisations receiving Grants should, irrespective of the amount involved, furnish a set of audited statement of accounts to",Accounts Officer after having utilised the grants,33:
Internal audit of the accounts of a grantee institution shall be conducted by the,"Principal Accounts Office of the Ministry or Department,",34:
The accounts of the Grantee Institution or Organisation shall be audited by the CAG under Section,14 of the DPC Act,35:
Audit by the CAG under Section 14 is conditional,Minimum grant is ₹ 25 lakh in the year and forms 75% of entity’s total expenditure,36:
"Irrespective of the percentage of entity met by the grants, the CAG is authorised to conduct audit u/s 14 of the DPC when",Grants or loans in a FY are not less than ₹ 1 crore,37:
"Where the accounts are required to be audited by the CAG in a financial year, he shall continue to audit the accounts for a further period of",2 years even if conditions are not fulfilled.,38:
CAG is empowered to scrutinise the procedure adopted by sanctioning authority with regards to sanction grants/loans under Section,15(1) of the DPC Act,39:
"Where the CAG is the sole auditor for a local Body or Institution, auditing charges will be borne by",The auditee institution,40:
Approved and authenticated annual accounts to be made available by the Autonomous Body to the concerned Audit Office by the,30th June,41:
Issue of the final SAR in English version with audit certificate to Autonomous Body/ Government concerned by,31st October,42:
Submission of the Annual Report and Audited Accounts to the Nodal for it to be laid on the Table of the Parliament by,31st December,43:
Rule of GFR 2017 that deals with Utilisation Certificate is,Rule 238,44:
The Utilization Certificate should be submitted by grantee/loanee concerned. within,12 months of the closure of the FY,45:
Release of Grants-in-aid shall be done only after utilisation certificate and the annual audited accounts when,in excess of 75% of the total amount sanctioned for the subsequent FY,46:
Utilization certificates need not be furnished in cases where the Grants–in–aid /CFA are being made as,reimbursement of expenditure already incurred on the basis of duly audited accounts.,47:
All the Ministries or Departments of Government of India should include in their Annual Report a statement showing the quantum of funds provide to Private and Voluntary Organizations,Grants of ₹ 10 lakh and up-to ₹ 50 lakh,48:
The Annual Reports and accounts of Private and Voluntary Organizations receiving Grants-in-aid of ₹ 50 lakh and above should be laid on the Table of the House within,9 months of the close of the succeeding FY.,49:
"When Central Grants are given to State Governments for implementation of Central Scheme, UC should be counter-signed by",Administrative Secretary of the Division regulating the Scheme/Finance Secretary.,50:
"When Central Grants are given to State Governments for expenditure to be incurred by them through local bodies or private institutions, the Utilization Certificates should be furnished by",The State Government,51:
"The Grantee Institutions or Organisations should be required to submit performance cum achievement reports soon after the end of the financial year, and in any case, not later than",6 months after the close of the FY.,52:
performance-cum-achievement reports need not be obtained non-recurring Grants are meant for,"celebration of anniversaries, conduct of special tours and maintenance Grants",53:
The sanctioning authority may dispense with the submission of performance cum achievement reports where the grantee receives the recurring grant-in-aid,Not exceeding ₹ 25 lakh,54:
Discretionary grants is applicable to,Non-recurring grants only,55:
Grants-in-aid for provision of amenities or of recreational or welfare facilities to the staff of the offices of the Government are regulated under orders of,Ministry of Home Affairs,56:
The Grant in aid towards amenities or of recreational or welfare facilities to the staff will be admissible on the basis of,the total strength borne on regular establishment,57:
The rate of the Grant-in-aid towards amenities or of recreational or welfare facilities to the eligible staff will be Rupees,₹ 50 per head per annum+ Additional matching grant-in-aid up to ₹ 25. Maximum ₹ 75/- per annum,58:
Additional grant of ₹ 25 is given to,match the subscriptions collected during the previous FY by the existing staff clubs/till the date of proposal in case of new club.,59:
The total strength of the eligible staff that is taken into account as on,31st March of previous FY.,60:
"For setting up of recreational club, one time Grant may be sanctioned to the tune of maximum of ₹",₹ 50000/-,61:
The accounts of recreational clubs duly audited by an Internal Auditor should be obtained on or before,30th April of succeeding year.,62:
Powers and Procedure for sanction of loans are given in,Delegation of Financial Power Rules,63:
Nodal agency to finalise terms and conditions of loans by the Central Government is,"Budget Division, Department of Expenditure (MoF)",64:
Maximum period repayment of amount of loan and interest due,30 years (Specific cases only),65:
The term of repayment is to be calculated from the date on which the loan is,Completely drawn or declared by competent authority to be closed.,66:
Installment fixed for repayment of loan shall ordinarily be,Annual installment.,67:
"Any instalment paid before its due date may be taken entirely towards the principal, provided",it is accompanied by payment toward interest due up-to-date of actual payment of instalment,68:
"The interest for the full period shall be charged, if the payment of the instalment is in advance of the due date by",14 or less days,69:
"When the due date of repayment of any instalment of principal or interest falls on a Sunday or a public holiday, the revised due date will be",The next working days. The previous day where due date is 31st March.,70:
"the case of a loan sanctioned by the Central Govt. to a State Govt. on or before 31st March, which is adjusted in the books of the RBI in the month of April but in the accounts of the previous year, the due date will for repayment will fall on",31st March,71:
"When monetary settlement is involved in loan given by the Central Govt. to State Govt., the date of drawl of loan by the State Govt. is",date on which amount of a loan is actually credited to the account of the State Government by the RBI,72:
"Where no monetary settlement is involved in loan from Central Govt. to State Govt., the date of drawl will be",the last date of the month of account in which the adjustment is effected,73:
A notices in Form GFR-19 to the loanees other than State and Union Territory shall be issued in advance (a month) of due date by,"the Pr. AO or PAO who maintain the detailed accounts of loans,",74:
"Before approving the loan, the private applicant shall be asked to furnish the copies of profit and loss/income and expenditure accounts and balance sheets for the last",3 years,75:
"Loans to parties other than State Govt., wholly owned Govt Companies and Local Administration of UTs shall be sanctioned only against adequate security which should be at least",133.33% of the loan amount. 33.33% more than amount of loan.,76:
A loan should bear the interest for the period,for the day of payment but not for the day of repayment.,77:
Interest for a period shorter than a year is calculated,Number of days X Yearly rate of interest 365 or 366 as the case may be,78:
The repayment of principal and interest instalments may be rounded off to the nearest,Rupees,79:
A suitable period of moratorium,May be agreed for payment of principal but not in respect of interest on loan.,80:
"Loans to State and UT Governments, Local Bodies, Statutory Corporations, PSUs, etc. shall be sanctioned at",Normal rate of interest.,81:
"Concession, if any, given to normal rate of interest shall take",Form of direct subsidy. interest shall be paid in the first instance at the normal rates and subsidy shall be claimed separately.,82:
"At the time of sanctioning the loan, a written undertaking in Form GFR 15 shall be obtained from",a wholly Government-owned company,83:
In case of loan to wholly owned Govt. Companies a Undertaking in GFR 32 is obtained to the effect that,the fixed assets of the company shall not be hypothecated without prior approval of the Government,84:
"UC in respect of loan and grants-in-aid made to parties other than State Govt., wholly owned Govt. Companies and Local Administration of UTs shall be submitted within",18 months from close of the FY in which loan or grant-in-aid was sanctioned,85:
"In respect of loans the detailed accounts of which are maintained in the Audit Offices, the authorities sanctioning the loan shall furnish the UC in respect of",each individual case.,86:
"Where the detailed accounts of loan is maintained by the departmental authorities, UC to audit officer is submitted as",A consolidated Utilization Certificate,87:
"When a loan of public money is taken out in instalments,",each instalment of the loan so drawn shall be treated as a separate loan,88:
"where various instalments drawn during a FY are allowed to be consolidated into a single loan as at the end of that particular financial year, interest will be calculated",For each drawl separately.,89:
"In case of default in repayment of principal and interest, the penal or the higher rate of interest, should not be less than",2.5% above the normal rate of interest prescribed by Govt.,90:
"Submission of Utilization Certificate, Reports, Statements, etc. in respect of loan has been mentioned in GFR Rule.",256,91:
Any loans owing to their irrecoverability or otherwise may be written off by,competent authority with prior approval of Ministry of Finance,92:
Interest on interest-free loan is chargeable when,"There is default in repayment,",93:
"In the cases where in addition to interest free loans, subsidy is also provided to meet running expenses, in the event of any default in repayment,",the defaulted dues would be recovered out of the subsidy payable.,94:
"Detailed accounts of loans to Institutions and Organizations, etc., shall be maintained by",the Accounts Officer,95:
Annual Report on outstanding Central Loans borne on a Ministry/Department’s books as on 31st March each year shall be submitted by the Pr. AO to concerned Ministry/Department by,30th September,96:
"A copy of Annual Assessment Report on status of all outstanding loans, including timely and accurate payment of principal and interest due, shall be submitted by the Financial Advisor of the Administrative Ministry concerned to the Ministry of Finance by",30th June,97:
