question,answer,srno
Permissible corrections to balances of earlier years in cases other than cases eligible for writes-off of balances from DDR Heads closed to balance and classification thereof in accounts,Proforma Correction,01:
For initiating any proforma correction approval with full justification is required from,CGA,02:
"Expenditure incurred under the CFI and booked under concerned heads is accounted for in the Appropriation and Finance Accounts. However, the balances under the heads of loan, debt etc. will also be included in the",Finance Accounts,03:
"For Change of Classification, decision may be taken by Government in consultation with the Budget Division and Controller General of Accounts on the advice of the",CAG,04:
Certain increases or decreases in the opening balances of heads of accounts exclusively operated by them without routing the adjustments through the monthly accounts or the Statement of Central Transactions of the year for which the Finance Accounts are under preparation may be effected by,"Railway Board and Controller Aid, Account and Audit",05:
Conversion of Grants in aid to Loans and vice-versa given during any earlier financial year to a State Govt. or U.T. Govt. into a loan or conversion of a loan given earlier into Grant-in-aid with retrospective effect is done through,Proforma Correction,06:
"The raising or lowering down of balances under the two Minor Heads ""Advances for purchase of other conveyances"" and ""Other advances"" wherever necessary, may be done by",Pr. AO with approval of CGA,07:
"Adjustments relating to ""Proforma Correction"" will not be passed through the regular monthly accounts, will not be shown in the Statement of Central Transactions, and even the opening balances in such cases will not be corrected with a foot note.",Full details are submitted to CGA for Finance A/cs,08:
