question,option_a,option_b,option_c,option_d,answer,hint,srno
"Where the material is purchased by placing indent on D.G.S.&D, the existing procedure for making payment by the PAO of Division to PAO, Supply by operating",Debit to MPSSA,Minus debit to MPSSA,Credit to MPSSA,Minus credit to MPSSA,D,,84.
Inter-Departmental transaction on account of supplies made or services rendered to Cabinet Secretariat and Ministry of Defence has to be settled by operating,Debit to CSSA,Minus debit to CSSA,Credit to CSSA,Minus credit to CSSA,A,,85.
"Work done in a Public Works Division on behalf of another Division, including the Divisions of other Government the claims should be settled",by the Divisions amongst themselves with the intervention of the PAO,by the Divisions amongst themselves without the intervention of the PAO,by the PAOs of the Divisions concerned,by book transfer,B,,86.
"Who should see that there is clear authority of the responsible disbursing officer of his division for claims/transfer advised to other divisions, departments or Governments and that no charge advised by another division, department or Government is finally paid/adjusted until all the necessary vouchers have been received?",DA,DO,PAO,CCA,A,,87.
Government employees are covered under the New Pension Scheme’2004 who has joined Government Service,on or after 01-01-2005,on or after 01-04-2005,on or after 01-01-2004,on or after 01-04-2004,C,,88.
The Administrative Branch of the Division will maintain the Bills Register in form,CPWA 9,GAR 9,CPWA 14,GAR 14,B,,89.
The DDOs/CDDOs will have to prepare separate Pay Bills in respect of Government servants under NPS and will send the same with all other schedules to the Pay and Accounts Officer so as to reach him,on or before 15th of the month to which the Bills relate,on or before 17th of the month to which the Bills relate,on or before 20th of the month to which the Bills relate,on or before 25th of the month to which the Bills relate.,C,(15th in the case of DDOs/CDDOs situated in far flung areas not easily accessible),90.
An account of undisbursed pay and allowances should be kept in a Register in Form,CPWA 25,CPWA 29,GAR 29,GAR 25,D,,91.
It should be ensured that undisbursed amount shall be refunded either in cash or by short drawl if it remained undisbursed for,six-months,one month,two months,three months,D,,92.
A bill register in the form GAR 9 should be maintained by all Heads of Offices who are authorized to draw money on account of pay and allowances etc by Cheque on bills signed by them. The register should be reviewed yearly by a Gazetted Officer and the result of review recorded thereon.,True,False,,,B,(monthly review),93.
All orders revising sanctioned scales or sanctioning the creation or abolition of permanent or temporary appointments should at once be communicated to the,Divisional Officer,DG (Works)/CE,PAO,CCA,C,,94.
"In the case of all transfers of divisional, sub-divisional or other executive charges, a report of transfer of charge should be prepared and sent to the ______ through the ____","PAO, SE","SE, PAO","CCA, SE","CCA, PAO",A,,95.
"Whenever the transfer of charge is prolonged so that two Government servants may be entitled ‘to draw pay and allowances simultaneously for the same appointment, who should intimate the PAO to consider relieving officer either on duty or on leave or on joining time?",DO,SE,CE,DG(Works),B,,96.
"If the contingent charges of a division excluding special contingencies during a month, exceed monthly limit for such charges fixed by the Admin Min/Administrator concerned, the bill for the month should be submitted for countersignature to",SE,CE,Admin. Min/Administrator concerned,PAO,A,,97.
"At the end of the month, for submission to the Accounts Officer with the Monthly Account all contingent charges including Stock and adjustment transactions should be consolidated in a bill headed ‘Not Payable’ in form",GAR 29,GAR 30,GAR 31,GAR 32,C,,98.
Register of contingent expenditure should be prepared in Form,GAR 27,GAR 26,GAR 28,GAR 25,A,,99.
Which of the following offices shall not be treated as Direction/Special Office?,SE,Superintendent of Work,CE,CCA,D,,100.
The monetary transactions of heads of special offices are divided into two distinct groups. Pick the correct one,Pay and Allowance and Contingent charges,Capital Charges and Revenue Charges,Departmental charges and Non-departmental charges,Budgeted charges and Special Charges,A,,101.
Establishment bills will be presented for encashment at the Zonal PAO at the places where the office of the Accounts Officer is located and the authorized division at the places other than the place of office of Accounts Officer.,True,False,,,A,,102.
"Purchase and repair of scientific instruments and drawing materials, camp equipage, motor cars pertaining to a Direction/Special Office shall be booked to",Tools and Plant,Machinery & Equipment,Contingency,Work (Contingency),C,,103.
"Transfer Entry orders, Form 53, relating to the accounts of the month of sub-division will be sent to the Divisional Officer",Within 3 days the date on which the accounts of a month are closed in the Sub-Divisional Office,Within 7 days the date on which the accounts of a month are closed in the Sub-Divisional Office,Within 10 days the date on which the accounts of a month are closed in the Sub-Divisional Office,Within 15 days the date on which the accounts of a month are closed in the Sub-Divisional Office,A,,104.
Pick the incorrect one regarding submission of report/return of a sub-division to Divisional Office,"Statement of Receipt, Issues and Balance of Road Metal in CPWA 16- Monthly",Statement/Report on recoveries of License Fee of building and land-Monthly,Report of verification of stores-Monthly,Tools and Plant Ledger- On such dates as prescribed by the Divisional Officer,C,(Occasional-as no frequency fixed but immediately after each verification),105.
