question,option_a,option_b,option_c,option_d,answer,hint,srno
Departmental classified abstract is,collection of monthly transaction as whole relating to each civil department,collection of monthly transaction as whole relating to a major head of account coextensive with any particular department,collection of monthly transaction as whole relating to each civil department or a major head of account coextensive with any particular department,collection of monthly transaction as whole relating to each civil department or a major head of account not coextensive with any particular department,D ,,1.
Departmental classified abstract is prepared by,Concerned treasury,State Treasury,Accountant General,State Government,C ,,2.
Departmental classified abstracts should be maintained,Separate Departmental classified abstracts should be maintained for 'State' and UT' transactions,separate classified abstracts in respect of transactions on account of Central Pension occurred in the State/UT,Both A&B,None of the given,C ,,3.
Pick the correct,One Departmental Classified Abstract should ordinarily be maintained for each department or major head of account,"In the case of small departments or major heads under which the transactions are few, the transactions of two or more such departments or major heads, may be recorded in a single classified abstract at the discretion of State Government",Both A&B,None of the above,A ,,4.
Classified Abstracts,"are maintained separately for major heads relating to Debt, Deposit & Remittance","are not to be maintained separately for major heads relating to Debt, Deposit & Remittance","may or may not to be maintained separately for major heads relating to Debt, Deposit & Remittance as directed by the State Government","may or may not to be maintained separately for major heads relating to Debt, Deposit & Remittance as directed by the Accountant General.",B ,,5.
Transaction pertaining to DDR appearing in the Treasury Cash Accounts and List of Payments and in the Departmental and other abstracts shall be collected for the whole circle of account in,Abstract book,Detail book,Loan book,Suspense Book,B ,,6.
Recording in the Detail Book is made,Department wise,Treasury wise,Major head of account wise,All of the above,C ,,7.
Departmental Classified Abstract consists,four parts,five parts,six parts,seven parts,D ,,8.
Parts of Departmental Classified Abstract consists i. Details of Revenue and Details of Expenditure ii. Details of DDR receipt brought into accounts and Details of DDR disbursement brought into accounts iii. Details of recoveries from Payment vouchers iv. A proof side for receipt side and a proof side for expenditure side v. Details of lapsed deposit,"i, ii, iii and iv","ii, iii, iv and v","i, ii, iv and v",All of the above,A ,,9.
"Pick the correct regarding the Departmental Classified Abstract (i). A vertical column should be provided, in the prescribed order, for each detailed head opened under the major and minor heads relating to the abstract and a number of columns in their proper places for the total receipts of a treasury, etc., under each minor head (ii). In abstracts where transactions under more than one major head are included, there will be columns for major head totals also. (iii). Horizontally, a line should be provided in the abstract for each treasury (iv). There should be as many lines as the AG may deem necessary for entering receipts transferred through suspense slips from the Settlement Account and the abstracts of other Departments v. Finally a line for transfers adjusted through the Combined Transfer Ledger","i, ii, iii and iv","ii, iii, iv and v","i, ii, iv and v",All of the above.,D ,,10.
It helps to ensure that details of receipt and payment agree with the aggregate of the certified total of the treasury schedules of receipts and payments and of the suspense lips representing items transferred from other sections,Broadsheet,Proof Sheet,Trial Sheet,Detail Sheet,B ,,11.
Pick the incorrect one,"On receipt of the schedule and vouchers in the compilation group of the Treasury/Departmental Audit Sections, the Departmental Auditor, should compare the vouchers with the schedules, ascertain that none are missing and arrange them in the order money value",He should then proceed with the Compilation work and posting of the Departmental Classified Abstract.,"After the compilation for either schedule of payment is over, the Vouchers should be transferred to the Audit Group of the Treasury Departmental Audit Sections, Gazetted Audit Sections and other Audit Sections for audit.",None of the given,A ,,12.
"In the case of heads of account where the transactions are limited and such direct posting is not attended with any risk or inconvenience, direct posting of the Consolidated Abstract without the intervention of Departmental Classified Abstracts may be allowed by",The Accounts Officer/Sr. Accounts officer in consultation with the Group Officer.,The Group Officer in consultation with the Accountant General,The Accountant General at his discretion,The Accountant General in with consultation of the CAG,C ,,13.
The amount of payments relating to each detailed head with the numbers of the vouchers pertaining thereto should be entered in a Compilation (not standardised) separately for each schedule except,Interest Head,Refund Head,Remittance Head,All of the above,B ,,14.
Pick the correct one,"The gross, and not the net amount of the voucher should be taken as the amount of the payment relating to the head concerned, even though certain charges on the voucher may have been placed under objection",when a recovery relating to an overpayment is made by short payment of an item debitable to the same detailed head the net amount should be taken,Both A&B,None of the given,C,,15.
To facilitate posting a guide letter or number or symbol may be assigned to,each major head under Sector,each minor head under major head,each detailed head under minor head,All of the above,C ,,16.
Deductions shown in payment vouchers as have not been initially credited by transfer to the receipt heads concerned in the treasury accounts should be recorded in,Part II Departmental Classified Abstract,Part III Departmental Classified Abstract,Part IV Departmental Classified Abstract,Part VII Departmental Classified Abstract,B ,,17.
Recoveries should not be treated as deduction,Recoveries which are creditable to any of the detailed heads under the major head to which the payments on a voucher relate,"Recoveries which are creditable to another major head, the Departmental Classified Abstract in respect of which is not separately maintained from the major head to which the payment on the voucher relates",Both A&B,None of the above,C ,,18.
"Deduction shown in payment vouchers for subscriptions to Provident Funds, which have not been accounted for as receipts in treasury accounts should be recorded in an appendix in",AC I,AC II,AC III,AC IV,A ,,19.
The appendix with a certificate to the effect that the totals agree with the credits in the departmental abstract should then be passed on the,Book Section,Fund Section,Treasury Section,Audit Section,B ,,20.
Parts in which Appendix is sent to Fund Section,Four,Three,One,Two,D ,,21.
Parts in which Appendix is sent to Fund Section,the portion relating to the first schedule of payments being sent with a certificate of agreement after the compilation of the vouchers of that schedule,"the portion relating to the second schedule into which the total deductions of the first part also should be brought in order to give the monthly total, after completion of the departmental accounts.",Both A&B,None of the above,C ,,22.
Total of compilation book should agree,"deduction from the first schedule of payment the aggregate amount shown as deduction from vouchers for credit in Part three (3) to Provident Funds, etc.",deducting to the result the amount of payments on account of refunds of revenue,Both A&B,None of the above,A ,,23.
"When the entries against a treasury in the Compilation Book have been posted and proved,","the payments for the month at the treasury under each detailed head including ""Refunds"" should be brought together in the Compilation Book for the first schedule","the payments for the month at the treasury under each detailed head except ""Refunds"" should be brought together in the Compilation Book for the first schedule.","the payments for the month at the treasury under each detailed head including ""Refunds"" should be brought together in the Compilation Book for the second schedule","the payments for the month at the treasury under each detailed head except ""Refunds"" should be brought together in the Compilation Book for the second schedule",B ,,24.
The month's total payments as shown in the second schedule of payments should also be posted,in part (5) as a plus entry under the Remittance head 8782-Deptt. Adjusting of the Deptt. A/c,in part (5) as a Minus entry under the Remittance head 8782-Deptt. Adjusting of the Deptt. A/c,in part (5) as a plus entry under the suspense head 8658-Deptt. Adjusting of the Deptt. A/c,in part (5) as a Minus entry under the suspense head 8658-Deptt. Adjusting of the Deptt. A/c,D ,,25.
The total of Part 4 and Part 5 of abstract against each treasury will agree with the difference between the amount of a,"Recoveries from payment vouchers for credit to Provident Funds, etc. as posted in part one (1)",Payments at the treasury on account of refunds of revenue as posted in part three (3),Both A&B,None of the given,D ,,26.
The final stage in the completion of the abstract is,the preparation of the proof sheets in parts (6) and (7),the preparation of the proof sheets in parts (7) and (8),the preparation of the closing sheet in parts (6) and (7),the preparation of the closing sheet in parts (7) and (8),A ,,27.
Pick the correct one,The Classified Abstract test checked by the Section Officer and duly passed by the Gazetted officerin-charge should be utilised as the basis of Consolidated Abstract,The Classified Abstract test checked by the Gazetted officer-in-charge and duly passed by the Group officer-in-charge should be utilised as the basis of Consolidated Abstract,The Classified Abstract test checked by the Gazetted officer-in-charge and duly passed by the Accountant General should be utilised as the basis of Consolidated Abstract,The Classified Abstract test checked by the Group officer-in-charge and duly passed by the Accountant General should be utilised as the basis of Consolidated Abstract,A ,,28.
Section Officer is responsible for the correctness of the posting in the compilation book in respect of,any major head account and for the tracing of the entry in the classified abstract items of over Rs. 10000/-,any major head account and for the tracing of the entry in the classified abstract items of over Rs. 2500/,any detailed head account and for the tracing of the entry in the classified abstract items of over Rs. 10000/-,any detailed head account and for the tracing of the entry in the classified abstract items of over Rs. 2500/,D ,,29.
Gazetted Officer-in-Charge is responsible for the correctness of the posting in the compilation book in respect of,any major head account and for the tracing of the entry in the classified abstract items of over Rs. 5000/-,any major head account and for the tracing of the entry in the classified abstract items of over Rs. 10000/,any detailed head account and for the tracing of the entry in the classified abstract items of over Rs. 10000/-,any detailed head account and for the tracing of the entry in the classified abstract items of over Rs. 5000/,C,,30.
Pick the correct one,"In respect of receipts, the treasury accounts rendered to AG’s Office indicates in the receipt schedules the receipts classified by Major, Minor and Detailed Heads of accounts with details of individual receipt.","In respect of receipts which cannot be so classified, full details are furnished separately on the basis of which the receipts are classified in Accounts Offices under the relevant Major. Minor and Detailed Heads of Account.",Both A&B,None of the given,B ,,31.
Departmental Consolidated Abstracts of Revenue receipts and Service payments are prepared from Departmental Classified Abstract in,Form AC 22,Form AC 21,Form AC 24,Form AC 23,A ,,32.
"State whether true or false Columns in Departmental Consolidated Abstract provided for monthly progressive totals under major heads, minor heads, sub-division of a minor head, and detailed heads in their proper place",True,False,,,A ,,33.
Pick the correct one,Progressive totals for each sub-head of a Grant or unit of appropriation and for each major head should always be filled in,"In order to avoid unnecessary totalling, in other cases progressive totals may be filled in at the end of the year or whenever they are necessary",Both A&B,None of the given,C ,,34.
Every head of account for which a column is provided in the Departmental Classified Abstract must appear in the Departmental Consolidated Abstract,under the Revenue head concerned,under Service heads concerned,under the Revenue and Service Heads concerned,"under the Revenue, Service and Debt Heads concerned",C ,,35.
The Consolidated Abstract duly agreed with corresponding totals in the Departmental Classified Abstract should be sent to the,Fund Section,Book Section,Audit Section,Treasury Section,B ,,36.
For the transactions brought to account in the Classified Abstract of treasury payments of the Public Works Department,No. separate Consolidated Abstract need be prepared,separate Consolidated Abstract need be prepared,separate or no separate Consolidated Abstract need be prepared as directed by the State Government,separate or no separate Consolidated Abstract need be prepared as directed by the Accountant General,A ,,37.
Pick the incorrect one,Book Section prepares consolidated monthly and annual accounts for the account circle as a whole,The Works Audit Department is AG office compile the Classified Abstracts of Public Works transactions from the monthly accounts received from the Public Works Divisions,"If section officer finds figures under any head are so abnormally high or low as compared with those of the previous months, he should raise a doubt whether there has been misposting misclassification and scrutinise before submitted to Gazetted officer in Charge",None of the given,D ,,38.
If an item in a transfer entry has to be taken to a head in Departmental account in the accounts of the same Government it should be classified in the transfer entry as pertaining to the suspense head,unclassified account,Departmental Adjusting Account relating to the other department,accounts awaiting settlement,PAO Suspense,A ,,39.
Pick the incorrect one,"The transfer entry with the necessary suspense slip should be sent, for acceptance and return to the section which maintains the Detail Book or Departmental Abstract in which the transferred item will be finally adjusted","When received back with acceptance, the transfer entry will be posted in the Combined Transfer Ledger and Abstract in form AC 24","If an item of receipt or payment relating to the Central Govt. other than Central Pensions is wrongly included in the schedule of State receipts or payments and vice versa, the amount should be credited or debited to PAO Suspense under 8658",None of the given,B ,,40.
The relevant particulars of wrongly included transactions should be passed on to the Section dealing with Inter-Govt. Settlement Account generally known as,Central Section,State Section,Account Current Section,Suspense Section,C ,,41.
"In respect of items of receipt/payment relating to CENTRAL PENSIONS wrongly included in the State schedule of receipts or payments and vice versa the amount should be credited or debited as the case may be, to the head",8786 Adjusting Account between Central & State Government.,8658 Adjusting Account between Central & State Government,8680 Adjusting Account between Central & State Government.,8793 Adjusting Account between Central & State Government,A ,,42.
The recoveries of overpayments whether made in cash or from payment vouchers shall be posted direct under the service head concerned in the Compilation Book as,Reduction of expenditure if they relate to overpayment pertaining to the current year,Reduction of expenditure if they relate to overpayment pertaining to any previous year,Reduction of expenditure whether they relate to overpayment pertaining to the current year or to any previous year,Reduction of expenditure if they relate to overpayment pertaining to the current year and miscellaneous receipt if they relate to overpayment pertaining to any previous year.,C ,,43.
State whether true or false If a recovery representing an over payment of the current year is made by short payment of an item debitable to the same detailed head or other detailed head no separate adjustment is needed,True,False,,,B ,,44.
As only the decrease/increase in cash balances during a month is shown in receipt/ payment side of the Divisional Accounts the differences between the opening and the closing balance shall be credited/debited under the head,8670-PW Departmental Cash Balances,8782-PW Departmental Cash Balances,8672-PW Departmental Cash Balances,8671-PW Departmental Cash Balances,D,,45.
"Public Works Classified Abstract is the main record, so far as the entire account circle is concerned, in respect of i. Revenue receipt and receipts and recoveries on capital account ii. Refund of Revenue iii. Other expenditure iv. Debt and remittance transactions","i, ii and iii","ii, iii and iv","i, ii and iv",All of the above,D ,,46.
The amount of other details to be recorded either in the classified abstracts or in the works audit summaries shall be prescribed by the,State Government,Accountant General,Either of State Government or AG,Both State Govt. and AG,B ,,47.
Pick the correct one,The subsidiary summaries maintained in the Works Audit Department known as the Works Audit Summaries,The information contained in these summaries may be utilised for preparation of the statements required for Finance Accounts and the Combined Finance und Revenue Accounts of the Central and State Governments as well as any proforma annual accounts,Both A&B,None of the given,C ,,48.
"For the purpose of either furnishing statistical information required by Government or of facilitating preparation of State Summaries, Divisional summaries are prepared",monthly,yearly,quarterly,monthly or as often in a year as may be necessary,D ,,49.
It is essential that the total of the transactions of the year for the entire circle of accounts under each head excluded from the classified abstract should be worked out through Works Audit Summaries at close of the,year,each month,each quarter,March and September,A ,,50.
Works Audit Register is prescribed by the,AG,CAG,State Government,CGA,B ,,51.
The forms of the summaries may be prescribed by the,AG according to local requirements,State Govt. according to local requirements,CAG,CGA,A ,,52.
"In respect of revenue and expenditure transactions connected with works of the Central Government Departments, the execution of which is entrusted to the Public Works Department as a standing arrangement, the AG acts as",Main Accounts Officer,Sub-Accounts Officer,Both A&B,None of the above,B ,,53.
Revenue and expenditure transactions of the Public Works Department which are brought to account direct on the books of the AG will,"enter the Monthly Accounts of Divisional Officers and therefore, be included in the Works Audit Registers as well as the summaries of the Works Audit Department",enter the Monthly Accounts of Divisional Officers but be excluded from the Works Audit Registers as well as the summaries of the Works Audit Department,not enter the Monthly Accounts of Divisional Officers but be included in the Works Audit Registers as well as the summaries of the Works Audit Department,"not enter the Monthly Accounts of Divisional Officers and will, therefore, be excluded from the Works Audit Registers as well as the summaries of the Works Audit Department",D ,,54.
Pick the correct one,Revenue and expenditure transactions of the Public Works Department which are brought to account direct on the books of the AG should ordinarily be entered in the Departmental Classified Abstract in full detail,"If the AG finds it more convenient, the details below the units of appropriation may be excluded from the Departmental Classified Abstract",Both A&B,None of the given,C ,,55.
State whether true or false The Consolidated abstract of the State Public Works transactions prepared from the account in the monthly Classified Abstracts,True,False,,,A ,,56.
The Classified Abstract and Consolidated Abstract of PWD shall,be in different form from the Classified Abstract and Consolidated Abstract for other Department,be in the same form as the Classified Abstract and Consolidated Abstract for other Department,be either in same or different form from the Classified Abstract and Consolidated Abstract for other Department as directed by the State government,be either in same or different form from the Classified Abstract and Consolidated Abstract for other Department as directed by the Accountant General.,B ,,57.
"The transactions accounted for by the Forest Officers under the heads ""Book Transfers-Government of the State of---"" should be shown by the AG in the Classified Abstract under the head",8550,8658,8782,8793,D ,,58.
"The expenditure shown in these compiled accounts of departmental officers are to be brought to account under the relevant major minor sub-head of account, affording",Contra Cr. to 8670 Cheque-Bill,Contra Dr. to 8670 Cheque-Bill,Contra Cr. to 8782 Remittance,Contra Dr. to 8782 Remittance,A ,,59.
The paid cheques received from the bank by the treasury/PAO will be forwarded to the AG along with the,monthly scrolls,fortnightly scrolls,weekly scrolls,daily scrolls,D,,60.
The last stage before handing over the Cash Account and the List of Payments of a treasury to the Book Department should be the posting of the balances and the totals in the Statement of,Drawers’ accounts,Disbursers’ accounts,PAO’s accounts,All of the above,B ,,61.
Pick the correct one,Statement of Disbursers' Accounts should be maintained separately for Central and State transactions in Form AC 2,"The entries of Central and State transactions relating to the treasury, the figures being taken from the Opening Abstract appended to the Cash Accounts.",Both A&B,None of the given,A ,,62.
The designation of the clerk in a Civil Account Office who is responsible for the adjustment of the entire treasury account of a district,Section Auditor,District Auditor,State Auditor,Departmental Auditor,B ,,63.
The entries in the Statements of Disbursers' Accounts should be made in the same order as is observed in the,Cash Balance Report,Accounts Summary Report,Deposit with RBI report,Cash Disbursement Report.,A ,,64.
Remittances in Transit–Local is a minor head under major head,8782,8675,8785,8999,D ,,65.
Opening balance and closing amount of local remittances in transit are taken from the,Cash Deposit Register,Cash Balance Register,Remittance Check Register,Remittance Balance Register,C ,,66.
The entire amount of the opening balance and closing balance of local remittances in transit should be posted under,Disbursement,Receipt respectively,Disbursement & Receipt respectively,Receipt & Disbursement respectively,C ,,67.
Pick the correct,"The amounts entered in Cash Balance as receipts and disbursements are also posted into the Detail Books as receipts and disbursements, respectively.","These are accounted under the head ""Remittances in Transit Local"" per contra debit or credit to the head ""Cash Remittance between Treasuries and currency chests""",Both A&B,None of the given,C ,,68.
The Statements of Disbursers' Accounts must be completed by incorporating the amounts which pass into the Detail Books through the Combined Transfer Ledger and Abstract in,the Book Department,the Fund Department,the Account Department,the Cash Department,A ,,69.
"In the Account office where the departmental system of account is followed, the drawing up of the abstract may he discontinued at the discretion of the",Administrative department,State Government,Accountant General,Accounts Officer,D ,,70.
"Deposits-State"" should be entered in the State Statement from where entry in Detail Book is made receipt or disbursement as the case may be against the head",Reserve Bank Deposit,Cash Balance,Departmental Balances,All of the above,A ,,71.
Pick the incorrect one,The Statement of Disbursers’ Accounts brings together the aggregate of the months' receipts and payments with the opening and closing balances of all officers rendering accounts to the AG,The Statement of Disbursers’ Accounts furnishes an effective check on the grand totals of the several Consolidated Abstracts as made Cut in the Abstract of Major Head Totals,The Consolidated Abstracts show the amount received and paid by all Accountants whereas the Statements of Disbursers' Accounts show the amounts received and paid on all accounts,None of the given.,C ,,72.
Procedure of Inter-Govt. Transactions & adjustment includes,"By sending advices to the Central Accounts Section (CAS) of the RBI, Nagpur, by the Accounts Officers. These are initially treated generally as ""Remittance transactions"" by the Civil Accountants General",By actual cash settlement through cheques and drafts being exchanged between the Accounts officers concerned,Both A&B,None of the given,C ,,73.
