question,option_a,option_b,option_c,option_d,answer,hint,srno
"State whether true or false        When a loan of public money is taken out in instalments each instalment of the loan so drawn shall be treated as a separate loan for purposes of repayment of principal and payment of interest thereon except where the various instalments drawn during a financial year are, for this purpose, allowed to be consolidated into a single loan as at the end of that particular financial year.",True,False,,,A,[Rule: 257],82.
"The penal or the higher rate of interest, as the case may be, shall not, except under special orders of Government, be less than",2% per annum above the normal rate of interest,2.5% per annum above the normal rate of interest,3% per annum above the normal rate of interest,5% per annum above the normal rate of interest,B,[Rule: 258 (1)],83.
"Any default in the payment of interest upon a loan or in the repayment of principal where details of accounts of loan is maintained by Accounts Officer, shall be promptly reported by him to",Principal Accounts Officer,Loanee Institution,Ministry of Finance,sanctioning authority.,D,[Rule: 258 (2)],84.
Pick the incorrect one,"The event of any default in repayment in the case of grant of interest free loans, interest at prescribed rates will be chargeable on the loans.","In the case of loans sanctioned at concessional rates of interest the difference between the normal rate and concessional rate), shall be made conditional upon prompt repayments of principal and payment of interest thereon by the entity concerned.","In the cases where in addition to interest free loans, subsidy is also provided to meet running expenses the sanction letter shall provide that in the event of any default in repayment, the defaulted dues would be recovered out of the subsidy payable.",None of the above,D,[Rule: 258 ()3],85.
"A competent authority may remit or write off any loans owing to their irrecoverability or otherwise, after prior approval of the",Ministry of Finance,Accounts Officer,Administrative Ministry/Department,Parliament,A,[Rule: 259],86.
"Detailed accounts of loans to Institutions and Organizations, etc., shall be maintained by the Accounts Officer who shall watch their recovery and see that the conditions attached to each loan are fulfilled Subject to such general or specific directions as may be given by the",Administrative Ministry/Department,Ministry of Finance,C&AG,Principal Accounts Officer,C,[Rule: 260],87.
Each Principal Accounts Officer shall submit a statement showing the details of outstanding Central Loans borne on his books as on 31st March each year to the,concerned Ministry or Department,C&AG,Ministry of Finance,Chief Controller of Accounts of concerned Ministry or Department,A,[Rule: 262],88.
The above statement is submitted in Form,GFR 11,GFR 12,GFR 13,GFR 14,C,[Rule: 262],89.
This statement in GFR 13 shall be submitted not later than the,30th  April of following year,30th June of following year,30th  September of following year,31st December of following year,C,[Rule: 262],90.
The Administrative Ministries shall keep watch over the receipt of the Annual Statements regularly from the Accounts Office in Form,GFR 20,GFR 19,GFR 18,GFR 17,A,[Rule: 263 (1)],91.
"A copy of Annual Assessment Report on status of all outstanding loans, including timely and accurate payment of principal and interest due, shall be submitted by the Financial Advisor of the Administrative Ministry concerned by 30th June of each financial year to",concerned Ministry or Department,C&AG,Ministry of Finance,Chief Controller of Accounts of concerned Ministry or Department,C,[Rule: 263 (2)],92.
