question,option_a,option_b,option_c,option_d,answer,hint,srno
Cases of adjustment through CAS i. Repayment of loan and interest to Central Government ii. The special case of pensions (including commuted value) in respect of retired High Court Judges paid through State Treasuries or Public Sector Banks iii. Transactions connected with RBI Remittances occurring in State Non-banking treasuries/subtreasuries iv. Accounts of Inter-State Suspense' i.e. transactions between States inter-se v. Such other cases as may be specifically prescribed by the President on the advice of the CAG.,"i, ii, iii and iv","ii, iii, iv and v","i, ii, iv and v",All of the above,D ,,74.
"All transactions adjustable through rendering advices to CAS, RBI shall initially be brought to account","Centre-8658, State-8793","Centra-8786, State-8793",Both Central and State-8658,Both Central and State-8793,B,,75.
In respect of the head Inter-State Suspense Accounts (8793) there shall be,sub-heads for each State Government,combined sub-head for all the all the State Govt.,Separate sub-head for all the State Govt. and separate sub-head for UT Govt.,single combined sub-head for all the all the State Govt. and UT Govt.,A ,,76.
State whether true or false In respect of Adjusting Account between Central and State Governments for each item of credit/debit there shall be a corresponding debit/credit under the same head under the Central Section of Accounts.,True,False,,,A ,,77.
Entry appearing in Adjusting Account between Central and State Governments,Credit (Payable to State Govt.) and Debit entry (Payable by the State Govt.),Credit (Payable by the State Govt.) and Debit entry (Payable to State Govt.),Either A or B,Neither A nor B,B ,,78.
Central transactions appearing in Adjusting Account between Central and State Government shall be settled,monthly,daily,fortnightly or at other prescribed intervals without waiting for the closure of a month's account.,weekly or at other prescribed intervals without waiting for the closure of a month’s account.,D ,,79.
Central transactions appearing in Adjusting Account between Central and State Government should be consolidated by the AG in Part-I of the Register of adjustments with the Reserve Bank in Form,AC 4,AC 5,AC 3,AC 6,C ,,80.
"Advices for making necessary transfers of the balances between the Central and State Governments should be sent by the AG to CAS, RBI him in Form",AC 4,AC 5,AC 3,AC 6,A ,,81.
"Other Inter-Government transactions including those relating to ""Inter-State Suspense Accounts, whether appearing in the Treasury/Department or other inward settlement Accounts, or originating in the books of the AG by transfer entries, should usually be advised to the CAS, RBI, Nagpur for adjustment",Once a week,once a month,once a fortnight,once a quarter,B ,,82.
Central transactions appearing in Adjusting Account between Central and State Government is not operated in respect of,Pension of Freedom Fighter,Social Security Scheme,Repayment of loan and interest,All of the above,C ,,83.
"In respect of repayment of central loan & Interest, advice by the AG to CAS RBI by",debiting Head Central Accounts Office-RBI Suspense under Major Head (8658) and per contra credit to relevant public debt/Interest head,crediting Head Central Accounts Office-RBI Suspense under Major Head (8658) and per contra debit to relevant public debt/Interest head,debiting Head Central Accounts Office-RBI Deposit under Major Head (8675) and per contra credit to relevant public debt/Interest head,crediting Head Central Accounts Office-RBI Deposit under Major Head (8675) and per contra debit to relevant public debt/Interest head,B ,,84.
On receipt of the clearance memo from the Bank against advice of the AG for repayment of central loan & Interest accounting entries to be made in account,"by minus crediting the suspense head (8658) ""Central Accounts Office-RBI Suspense"" per contra credit to RBI Deposit 8675","by minus debiting the suspense head (8658) ""Central Accounts Office-RBI Suspense"" per contra credit to RBI Deposit 8675","by minus crediting the RBI Deposit (8675) ""Central Accounts Office-RBI Suspense"" per contra credit to Cash Balance 8999","by minus debiting the RBI Deposit (8675) ""Central Accounts Office-RBI Suspense"" per contra credit to Cash Balance 8999",A ,,85.
Pick the incorrect one,"The Central Accounts Section, RBI will carry out the adjustments in the accounts of a month, if the necessary advices relating to that month are communicated to it not later than the 7th of the following month.",A memo should invariably be sent to the Central Accounts Section of the Bank intimating the number and date of the last advice sent to the Bank for adjustment in the accounts of the previous month on 7th of the following month,"If 7th of the following month happens to be a holiday, the requisite memo shall be sent to the CAS on next working day.",None of the given,C ,,86.
"Inter-Government adjustments in respect of transaction pertaining to a financial year will not be carried out by the RBI in the accounts of that year, if the necessary advice is not sent by the",7th April of succeeding year,12th April of succeeding year,15th April of succeeding year,25th April of succeeding year,D ,,87.
"The inter-Government transactions for the month of March should be advised in batches to the CAS, Reserve Bank by telegram on the","5th, 15th and 25th of April or r previous day if these days happen to be a holiday","1st ,7th, 15th and 25th of April or previous day if these days happen to be a holiday","7th, 15th, 21st and 25th of April or previous day if these days happen to be a holiday","10th, 17th and 25th of April or previous day if these days happen to be a holiday",A ,,88.
Pick the correct one,"An advice of adjustment should be sent to the CAS, RBI on each of the batch dates, if adjustments exist to be communicated and no statement to be rendered when there are no adjustments to be communicated",The last advice to be issued on the 25th of April should include a certificate of the AG that no further adjustment will be intimated to the Bank for inclusion in the Accounts of the previous financial year,Both A&B,None of the given,B ,,89.
An inter-government transactions pertaining to a financial year that come to notice after 25th April of the following year,they should be left outstanding under the head Adjusting Account between Central and State Governments will be cleared following year through advice.,they should be cleared from the head Adjusting Account between Central and State Governments by transferring the same to Head 8680-General Misc Services and will be cleared following year through advice.,they should be left outstanding under the head Adjusting Account between Central and State Governments will be cleared following year through Cash Settlement.,they should be cleared from the head Adjusting Account between Central and State Governments by transferring the same to Head 8680-General Misc. Services and will be cleared following year through Cash Settlement.,A,,90.
Register of Adjustment & Advices to RBI is maintained in,AC 5,AC 6,AC 3,AC 4,C ,,91.
Register of Adjustment & Advices to RBI is maintained in,two parts,four parts,single part,three parts,D ,,92.
Pick the correct one regarding Register of Adjustment & Advices to RBI,Consolidation transactions involving adjustments between the Central and State Governments through the Bank in Part I.,The net total of the debits and credits worked out in this pat should be taken at the end of each prescribed period are taken to Part III of the register,The un-adjusted balance of the previous month under the bead 'Adjusting Account between Central and State Governments' as worked out in PART II of the Register should also be brought forward in Part III of the Register,All of the above,A ,,93.
"Adjustments between Central and State Governments which are initiated by the AG with the Bank, without passing on the transactions initially through the head should also be entered in part II",Part I of Register of Adjustment & Advices to RBI,Part II of Register of Adjustment & Advices to RBI,Part III of Register of Adjustment & Advices to RBI,None of the given,B ,,94.
"Advice for CAS, RBI should be prepared in AC 4 on the basis of information available in",Part I of Register of Adjustment & Advices to RBI,Part II of Register of Adjustment & Advices to RBI,Part III of Register of Adjustment & Advices to RBI,None of the given,B ,,95.
State whether true or false The credits and debits worked out in part III of the Register of Adjustment & Advices to RBI in a month should be agreed for Receipts and disbursements under the head with the State Detail Book,True,False,,,A ,,96.
"For inclusion in the next advice to the Bank, the unadjusted balance at the end of the month, should be transferred to",Part I of Register of Adjustment & Advices to RBI,Part II of Register of Adjustment & Advices to RBI,Part III of Register of Adjustment & Advices to RBI,None of the given,B ,,97.
Pick the correct one,Part III of the Register of Adjustment & Advices to RBI may at the discretion of the AG be posted direct from State Detail Books (Parts I),In such case the unadjusted balance at the end of the month worked out in the Register should be agreed with State Ledger AC27/AC28,The totals of Cr and Dr appearing under the head Adjusting Account between Central and State Governments appearing in the STATE SECTION of Accounts of an AG should agree respectively with the totals of Dr and Cr under the same head in the CENTRAL SECTION of Account.,All of the above,D ,,98.
The advices of adjustments in Form A.C 4 relating to a financial year issued to the Bank should be numbered serially for,Financial Year,Each Day,Each Month,Each Week,C ,,99.
Clearance Memo is prepared in,"AC 5 by CAS, RBI","AC 5 by CAS, AG","AC 6 by CAS, RBI","AC 6 by CAS, AG",A ,,100.
"On receipt of the Clearance Memo (AC 5) from CAS, RBI regarding adjustment made for the advice rendered by the AG",Dr/Cr to 8675 in the State Section of Accounts and per contra Cr/Dr to Adjusting Account and Cr/Dr to 8675 in the Central Section of Accounts and per contra Dr/Cr to Adjusting Account,Dr/Cr to 8675 in the State Section of Accounts and per contra Cr/Dr to Adjusting Account and Dr/Cr to 8675 in the Central Section of Accounts and per contra Cr/Dr to Adjusting Account,Dr/Cr to 8658 in the State Section of Accounts and per contra Cr/Dr to Adjusting Account and Cr/Dr to 8658 in the Central Section of Accounts and per contra Dr/Cr to Adjusting Account,Dr/Cr to 8658 in the State Section of Accounts and per contra Cr/Dr to Adjusting Account and Dr/Cr to 8658 in the Central Section of Accounts and per contra Cr/Dr to Adjusting Account,A ,,101.
"Pensions including commuted value of pensions in respect of retired High Courts Judges who have served under State Governments, subsequently recoverable from the State Government concerned, are",at first instance Charged on Consolidated Fund of State,at first instance Charged on Consolidated Fund of India,at first instance Voted Expenditure for the State Govt.,at first instance Voted Expenditure for the Central govt.,B ,,102.
The initial payment of Pensions including commuted value of pensions in respect of retired High Courts Judges made through Treasuries/Public Sector Banks should be debited directly against the,State Balance in Central Section,State Balance in State Section,Central Balance in Central Section,Central Balance in State Section,C ,,103.
Such pensions are shown as expenditure Charged on the Consolidated Fund of India in terms of Article 112 (3) (d) (iii) of the Constitution under the bead,4071,8680,2075,2071,D ,,104.
Pick the correct one,The actual recovery from the State Governments on account of initial pension to Judges of High Courts should be effected by operating upon the head Adjusting Account between Central and State Governments' and making adjustment with the State Governments through Cash Settlement,"Where the pensions are paid initially through a Public Sector Bank or a State Treasury located outside the jurisdiction of the State, the recovery of the pensions from the concerned State will be effected by the AG of the State in whose Central Section, the charges initially stand debited by Operating Inter State Suspense A/c (8793)",Both A&B,None of the given,B,,105.
In order to work out the net debit and credit all inter-State transactions brought to account in a month in the various accounts and abstracts in an AG’s office should be brought together for the whole account circle in,part III of the Register of Adjustments with the Reserve Bank in Form AC 3,part II of the Register of Adjustments with the Reserve Bank in Form AC 3,part II of the Register of Adjustments with the Reserve Bank in Form AC 4,part III of the Register of Adjustments with the Reserve Bank in Form AC 4,A ,,106.
Pick the incorrect one,Advice to RBI for effecting adjustment for Inter-State Suspense Account is prepared in Form AC 4,"Copies of the advice supported by schedules, vouchers and other papers' should be forwarded to the AG concerned to enable them to incorporate the transactions in their books.","On receipt of Clearance Memo (AC 5) from the CAS, the AG who initiated the adjustment, should clear the outstanding in his accounts by (-) Dr/Cr 8793 and Cr/Dr-8675",none of the given,C ,,107.
"State whether true or false When a copy of the same intimation is received by the other AG concerned, he should make an adjustment in the STATE SECTION OF HIS ACCOUNTS under the head CAS, RBI under the Major Head 8786 by per contra debit or credit to the head 8675-Deposits with RBI",True,False,,,B ,,108.
"The CAS, RBI will send to each AG a statement showing the sum total of adjustments made against the Central balance at his instance, together with a statement of closing balances of the State for the respective month by",10th of following month and in case of March 25th April,25th of the following month in case of March 10th May,15th of following month and in case of March 25th May,25th of the following month in case of March 15th April,B ,,109.
The accounts through which the transactions are initially accounted for under the head 'Inter-State Suspense Accounts and reported by one AG to the concerned AG are known as,Settlement Account,Current Account,Outstanding Account,Shadow Account,A ,,110.
Types of Settlement A/c are,Capital and Revenue Settlement Account,Accepted and Rejected Settlement Account,Current and Previous Settlement Account,Outward and inward Settlement Account,D ,,111.
"Where there are no transactions against a particular State during a month,",No outward settlement account should be despatched to the AG or AO concerned,a 'NIL' outward settlement account should invariably be despatched to the AG or AO concerned),It is at the discretion of the AG that a 'NIL' outward settlement account should be despatched to the AG or AO concerned or not.,It is at the mutual consent of the AsG that a 'NIL' outward settlement account should be despatched to the AG or AO concerned or not.,B ,,112.
Pick the correct one,The Outward Settlement Account shall be prepared in Form AC 7,The Outward Settlement Account shall consist of a copy of the monthly advice of adjustments sent to the RBI supported by schedules of credits and debits and connected vouchers or other documents working up to the net credit or debit advised to the RBI,The schedules accompanying the Account with suitable modifications may be prepared in AC 7,All of the above,D ,,113.
Pick the incorrect one,All transactions should be detailed in the schedules accompanying the settlement Account but in the case of cheques and remittances of Public Works Officers it should be sufficient to state the amount paid or received at each treasury on account of each Public Works Division,The schedules should be supported by treasury consolidated receipts and paid cheques,Neither A nor B,Both A&B,C ,,114.
Public Works Outward items which represent charges for work done should be supported by certificate in a form prescribed by the,State Government on advice of AG,President on advice of CAG,CAG on the advice of the CGA,Central Government on advice of CAG,B ,,115.
"In respect of Provident Fund transactions relating to Inter-State Settlement Account, the particular should be furnished to",Account Current in separate subsidiary schedules in AC 8 by Departmental audit & Other Sections,Departmental audit & Other Sections in separate subsidiary schedules in AC 8 by Account Current,Fund Section in separate subsidiary schedules in AC 8 by Account Current,Departmental audit & Other Sections in separate subsidiary schedules in AC 8 by Fund Section,A ,,116.
Personally responsible to see at the time of signing the settlement Account that subsidiary schedules and the covering list have been duly attached in proper form is,Group Officer,Accountant General,Section officer of Account Current,Branch officer of Account Current,D ,,117.
If the Accountant General finds any item which he cannot accept,"he/she should re-credit or re-debit it to the originating Accounts Officer after obtaining his/her consent where the same is clearly established, no need of consent is required",he/she should re-credit or re-debit it to the originating Accounts Officer without obtaining his/her consent.,he/she should re-credit or re-debit it to the originating Accounts Officer after obtaining his/her consent even in case where the same is clearly established,he/she cannot re-credit or re-debit it to the originating Accounts Officer at his end,A ,,118.
When a charge is paid in one account circle and is passed on through the settlement Accounts to be adjusted in another circle responsible for obtaining a voucher will be,the AO where the charge is to be adjusted,the AO of the paying circle,either A or B,Both A&B,B ,,119.
"Where the Government renders services or supplies stores to another Government, the AG of the Government which renders services or supplies should take credit for the supply in his accounts and initiate necessary adjustments against the balance of the other Government.",True,False,,,A,,120.
"Cash remitted into, or cheques drawn on treasuries in a State by Public Works and Forest Officers belonging to another State should be brought to account in the accounts of those officers under the head",8658,8670,8782,8786,C ,,121.
"Cash remitted into, or cheques drawn on treasuries in a State by Public Works and Forest Officers belonging to another State should be brought to account in the accounts of those officers under the head 8782 shall and cleared by the AG to whom the Public Works and Forest Officers render accounts, when the corresponding credits and debits received through the settlement Account.",True,False,,,A ,,122.
When a State AG receives intimation that an advance has been paid in another State to a Government servant under his audit control he/she should,debit 8658,credit 8658,credit pay and allowances,credit 8782,B ,,123.
"If any voucher/particular are wanting or if an item is not prima facie adjustable against the State, the necessary particulars in respect of such items should be entered in",an objection Book in Form A.C. 10 and the same is communicated to the other AG through an objection Statement,an objection Book in Form A.C. 11 and the same is communicated to the other AG through an objection Statement,a protest Register in Form A.C. 11 and the same is communicated to the other AG through an objection Statement,a protest Register in Form A.C. 10 and the same is communicated to the other AG through an objection Statement,A ,,124.
Individual items of credits and debits included in the schedules etc. should be,posted in consecutive series in single Inward Adjustments Registers in Form A.C. 11 for both credit and debit items,posted in consecutive series in two Inward Adjustments Registers in Form A.C. 11 one for credits and the other for debit items,posted in consecutive series in single Inward Adjustments Registers in Form A.C. 11 for both book transfer and cash settlement items,posted in consecutive series in two Inward Adjustments Registers in Form A.C. 11 one for book transfer and the other for cash settlement items,B ,,125.
Pick the correct one,"In respect of items which are adjustable under heads which have been opened in departmental abstracts, Suspense slips should be prepared in the Form A.C. 12",The Suspense slips should be entered in an outward Suspense slips Register in Form AC 13 and the suspense slips together with supporting vouchers or other documents should then be sent to the Departmental Auditor concerned for necessary adjustment in the Departmental Abstract,Both A&B,None of the given,C ,,126.
Pick the correct one,"On receipt of Register of Suspense Slips duly signed by the Section Officer, column of Inward Settlement Register should be posted in Column 4 to 8 by Departmental Auditor concerned","Items which are susceptible of adjustment, but cannot be treated as finally settled and placed under objection should be posted in Inward Settlement Register in columns 9 and 10",Both A&B,None of the given,A ,,127.
"Items held under objection not adjustable by the State and those which are prima facie adjustable in the books of the State, but vouchers or particulars to determine the Major head or Department against which the items are to be adjusted, are not available should be classified under the Head",8658 Suspense Accounts-Civil-Objection Book Suspense,8658 Suspense Accounts-Civil-Unclassified Suspense,8680-General Miscellaneous Services,8663 Accounting Adjustments Suspense,B ,,128.
"Items in respect of which the Department or Major head is clear from the schedules, but full particulars or vouchers are not available to determine the minor and detailed heads of account should be adjusted under the relevant Deptt Adjusting A/c or other head",True,False,,,A ,,129.
Pick the correct one,"After verification that each item in the Adjustment Registers has been classified, the total of the column 'Adjusted' should be struck, and the difference between the totals of the debit and credit Adjustment Registers should be worked out and agreed with the net credit or debit advised in the Inward Settlement",This difference should be adjusted as deduct entry Account under the head 'Central Accounts Office-Reserve Bank Suspense' in the relevant Adjustment Register,The amount adjusted from the Adjustment Register should be posed in Settlement Account Abstract in Form AC 14,All of the above,D ,,130.
Settlement Account Abstract shall be,posted only from the Adjustment Register and not from the schedules accompanying the inward account or from any other documents,posted only from the schedules accompanying the inward account and not from the Adjustment Register,posted from the Adjustment Register and from the schedules accompanying the inward account,posted from the Detail Book and not from Adjustment Register and the schedules accompanying the inward account,A ,,131.
Pick the correct one i. Every item of Settlement Account which is not finally disposed of should be entered in an objection statement (AC 15) and in the objection Book (AC 10) with suitable modification ii. The serial numbers of items of previous months still outstanding should be entered at the beginning of each objection statement and the objection Book. iii. The debit items should be entered first and then the Credit items. iv. The procedure for the upkeep of the objection Book and for watching the adjustment of items entered in it will be such as may be prescribed by the Accountant General,"ii, iii and iv","i, ii and iii","i, ii and iv",All of the above,B ,,132.
Major and Minor Head for Reserve Bank of India Remittance is,8999-103,8782-103,8782-105,8999-105,C ,,133.
The receipts and payments on behalf of the RBI are required to be cleared with the Bank,monthly,Daily,weekly,fortnightly,B ,,134.
"The schedules of receipts and payments on account of telegraphic transfers, drafts, etc. received by the Accountant General as far as possible, be forwarded to the Bank",on the same day,on the next working day,within two working days,within a week,A,,135.
Schedules of receipts and payment received from treasuries and sub-treasuries should be listed in a special form of advice prescribed by the,CAG,AG,State Government,RBI,D ,,136.
Schedules of receipts and payment received from treasuries and sub-treasuries should be listed in a special form of advice,The list should be prepared in triplicate by carbon process,The list should be prepared in triplicate in ink and not by carbon process,The list should be prepared in duplicate by carbon process.,The list should be prepared in duplicate in ink and not by carbon process,C ,,137.
"Disposal of list accompanied with Schedules, vouchers etc. should be","One copy of each list accompanied with Schedules, vouchers etc. should be forwarded to the CAS, RBI and other to AG/AO concerned","One copy of each list accompanied with Schedules, vouchers etc. should be forwarded to the CAS, RBI and other is retained as office record","Two copies of each list accompanied with Schedules, vouchers etc. should be forwarded to the CAS, RBI and other is retained as office record","One copy of each list accompanied with Schedules, vouchers etc. should be forwarded to the CAS, RBI, one copy to AG/AO concerned and third is retained as office record",B ,,138.
"For adjustment of transactions of particular month in the same month, all advices relating to that month should be communicated to the Bank not later than the",7th of the following month,10th of the following month,15th of the following month,25th of the following month,A ,,139.
